{
  "catalogId": "acceptance-criteria-catalog",
  "count": 84,
  "countPolicy": "derived from current coverage; historical count 77 is not preserved artificially",
  "criteria": [
    {
      "accessibility": "label announces CIK and legal name",
      "action": "open issuer",
      "area": "identity",
      "authority": "data-model.md",
      "authorityRef": "specs/001-fundamental-analysis-platform/data-model.md#issueridentity",
      "capabilities": "issuer_identity,evidence",
      "consumers": "UI; SEC gateway",
      "criterionId": "AC-001",
      "expectedState": "ready",
      "fixtureInput": "ticker alias maps to one CIK",
      "fixtureRef": "fixtures/acceptance/core-scenarios.json#/scenarios/AC-001",
      "oracle": "issuer stored/displayed by zero-padded CIK",
      "oracleKind": "single_exact_oracle",
      "preconditions": "issuer selected",
      "prohibitedResult": "ticker used as primary key",
      "recovery": "select candidate by CIK",
      "requirement": "CIK is authoritative",
      "sourceFinding": "V13-B06",
      "status": "ACTIVE",
      "requirementIds": [
        "FR-001",
        "NFR-006"
      ],
      "authorityId": "AUTH-003"
    },
    {
      "accessibility": "error announced in aria-live",
      "action": "select ticker",
      "area": "identity",
      "authority": "state-and-capability-matrix.md",
      "authorityRef": "specs/001-fundamental-analysis-platform/definitions/local-operation-issue-catalog.json#/issues/0",
      "capabilities": "definitions,evidence",
      "consumers": "UI; local orchestrator",
      "criterionId": "AC-002",
      "expectedState": "failed",
      "fixtureInput": "two issuer candidates",
      "fixtureRef": "fixtures/acceptance/core-scenarios.json#/scenarios/AC-002",
      "oracle": "local issue identity_ambiguous; no HTTP request and no Problem Details",
      "oracleKind": "single_exact_oracle",
      "preconditions": "multiple CIK candidates",
      "prohibitedResult": "first candidate auto-selected",
      "recovery": "select issuer by CIK",
      "requirement": "ambiguous ticker is not guessed",
      "sourceFinding": "V13-B05",
      "status": "ACTIVE",
      "requirementIds": [
        "FR-002",
        "FR-039",
        "FR-041",
        "NFR-004"
      ],
      "authorityId": "AUTH-020"
    },
    {
      "accessibility": "field error linked by aria-describedby",
      "action": "start acquisition",
      "area": "acquisition",
      "authority": "sec-acquisition.md",
      "authorityRef": "specs/001-fundamental-analysis-platform/contracts/sec-acquisition-policy.json",
      "capabilities": "definitions",
      "consumers": "gateway",
      "criterionId": "AC-003",
      "expectedState": "failed",
      "fixtureInput": "CIK with letters",
      "fixtureRef": "fixtures/acceptance/core-scenarios.json#/scenarios/AC-003",
      "oracle": "invalid_request; zero SEC calls",
      "oracleKind": "single_exact_oracle",
      "preconditions": "manual CIK entry",
      "prohibitedResult": "network call attempted",
      "recovery": "correct input",
      "requirement": "validate CIK before calls",
      "sourceFinding": "V13-B06",
      "status": "ACTIVE",
      "requirementIds": [
        "FR-001",
        "FR-003",
        "NFR-003"
      ],
      "authorityId": "AUTH-005"
    },
    {
      "accessibility": "busy state remains perceivable",
      "action": "refresh issuer",
      "area": "acquisition",
      "authority": "sec-acquisition.md",
      "authorityRef": "specs/001-fundamental-analysis-platform/contracts/sec-acquisition-policy.json",
      "capabilities": "issuer_identity,evidence",
      "consumers": "orchestrator",
      "criterionId": "AC-004",
      "expectedState": "checking",
      "fixtureInput": "fresh cache fixture",
      "fixtureRef": "fixtures/acceptance/core-scenarios.json#/scenarios/AC-004",
      "oracle": "cache hit recorded before endpoint",
      "oracleKind": "single_exact_oracle",
      "preconditions": "valid cached payload",
      "prohibitedResult": "unconditional SEC call",
      "recovery": "invalidate/retry",
      "requirement": "cache is checked first",
      "sourceFinding": "V13-B06",
      "status": "ACTIVE",
      "requirementIds": [
        "FR-031",
        "NFR-003"
      ],
      "authorityId": "AUTH-005"
    },
    {
      "accessibility": "progress announced",
      "action": "acquire",
      "area": "acquisition",
      "authority": "sec-acquisition.md",
      "authorityRef": "specs/001-fundamental-analysis-platform/contracts/sec-acquisition-policy.json",
      "capabilities": "issuer_identity,filings",
      "consumers": "gateway; worker",
      "criterionId": "AC-005",
      "expectedState": "acquiring",
      "fixtureInput": "complete Company Facts fixture",
      "fixtureRef": "fixtures/acceptance/core-scenarios.json#/scenarios/AC-005",
      "oracle": "Company Facts precedes any Company Concept",
      "oracleKind": "single_exact_oracle",
      "preconditions": "no valid cache",
      "prohibitedResult": "Company Concept fan-out first",
      "recovery": "retry",
      "requirement": "Company Facts is primary",
      "sourceFinding": "V13-B06",
      "status": "ACTIVE",
      "requirementIds": [
        "FR-004",
        "NFR-003"
      ],
      "authorityId": "AUTH-005"
    },
    {
      "accessibility": "forms have accessible labels",
      "action": "select filings",
      "area": "acquisition",
      "authority": "sec-acquisition.md",
      "authorityRef": "specs/001-fundamental-analysis-platform/contracts/sec-acquisition-policy.json",
      "capabilities": "filings,evidence",
      "consumers": "worker",
      "criterionId": "AC-006",
      "expectedState": "acquiring",
      "fixtureInput": "10-K,10-Q,8-K mix",
      "fixtureRef": "fixtures/acceptance/core-scenarios.json#/scenarios/AC-006",
      "oracle": "only admitted annual/quarter forms proceed",
      "oracleKind": "single_exact_oracle",
      "preconditions": "submissions received",
      "prohibitedResult": "8-K treated as primary statement",
      "recovery": "review evidence",
      "requirement": "select admissible filings",
      "sourceFinding": "V13-B06",
      "status": "ACTIVE",
      "requirementIds": [
        "FR-004",
        "FR-008",
        "NFR-003"
      ],
      "authorityId": "AUTH-005"
    },
    {
      "accessibility": "fallback status announced",
      "action": "evaluate fallback",
      "area": "acquisition",
      "authority": "sec-acquisition.md",
      "authorityRef": "specs/001-fundamental-analysis-platform/contracts/sec-acquisition-policy.json",
      "capabilities": "filings,evidence",
      "consumers": "gateway; worker",
      "criterionId": "AC-007",
      "expectedState": "acquiring",
      "fixtureInput": "known missing standard concept",
      "fixtureRef": "fixtures/acceptance/core-scenarios.json#/scenarios/AC-007",
      "oracle": "Company Concept call satisfies normative condition",
      "oracleKind": "single_exact_oracle",
      "preconditions": "Company Facts invalid/truncated/partial evidence",
      "prohibitedResult": "call per every missing concept",
      "recovery": "use local absent state",
      "requirement": "selective fallback only",
      "sourceFinding": "V13-B06",
      "status": "ACTIVE",
      "requirementIds": [
        "FR-005",
        "FR-007",
        "NFR-003"
      ],
      "authorityId": "AUTH-005"
    },
    {
      "accessibility": "ordered attempts readable",
      "action": "execute fallback",
      "area": "acquisition",
      "authority": "sec-acquisition.md",
      "authorityRef": "specs/001-fundamental-analysis-platform/contracts/sec-acquisition-policy.json",
      "capabilities": "evidence",
      "consumers": "worker",
      "criterionId": "AC-008",
      "expectedState": "acquiring",
      "fixtureInput": "priority fixture",
      "fixtureRef": "fixtures/acceptance/core-scenarios.json#/scenarios/AC-008",
      "oracle": "profilePriority→metricPriority→concept→taxonomy→tag",
      "oracleKind": "single_exact_oracle",
      "preconditions": "multiple eligible concepts",
      "prohibitedResult": "different call order across runs",
      "recovery": "restart",
      "requirement": "fallback order is deterministic",
      "sourceFinding": "V13-B06",
      "status": "ACTIVE",
      "requirementIds": [
        "FR-006",
        "NFR-001"
      ],
      "authorityId": "AUTH-005"
    },
    {
      "accessibility": "budget stop announced",
      "action": "execute acquisition",
      "area": "acquisition",
      "authority": "sec-acquisition.md",
      "authorityRef": "specs/001-fundamental-analysis-platform/contracts/sec-acquisition-policy.json",
      "capabilities": "filings,evidence",
      "consumers": "gateway; worker",
      "criterionId": "AC-009",
      "expectedState": "partial",
      "fixtureInput": "2 submissions+2 facts+10 concepts",
      "fixtureRef": "fixtures/acceptance/core-scenarios.json#/scenarios/AC-009",
      "oracle": "cost never exceeds 14",
      "oracleKind": "single_exact_oracle",
      "preconditions": "worst-case fixture",
      "prohibitedResult": "15th call issued",
      "recovery": "publish partial result",
      "requirement": "call budget is bounded",
      "sourceFinding": "V13-B06",
      "status": "ACTIVE",
      "requirementIds": [
        "FR-003",
        "FR-007",
        "NFR-003"
      ],
      "authorityId": "AUTH-005"
    },
    {
      "accessibility": "limitation announced",
      "action": "normalize",
      "area": "acquisition",
      "authority": "sec-acquisition.md",
      "authorityRef": "specs/001-fundamental-analysis-platform/contracts/sec-acquisition-policy.json",
      "capabilities": "fundamentals,evidence",
      "consumers": "worker; UI",
      "criterionId": "AC-010",
      "expectedState": "partial",
      "fixtureInput": "absent capex",
      "fixtureRef": "fixtures/acceptance/core-scenarios.json#/scenarios/AC-010",
      "oracle": "concept absent/metric insufficient; no global error",